{
  "schema_version": 2,
  "framework": "sqlalchemy",
  "version": "1.0",
  "description": "Sqlalchemy taint models (extracted from root rule pack)",
  "detection": {
    "imports": [
      "sqlalchemy",
      "from sqlalchemy",
      "import sqlalchemy",
      "create_engine(",
      "declarative_base",
      "sessionmaker("
    ],
    "patterns": [
      "Column(",
      "relationship(",
      "Session(",
      "scoped_session"
    ]
  },
  "models": [
    {
      "call": "sqlalchemy.engine.Engine.execute",
      "sinks": [
        {
          "kind": "sql",
          "port": {
            "parameter": 0
          }
        }
      ]
    },
    {
      "call": "sqlalchemy.orm.Session.execute",
      "sinks": [
        {
          "kind": "sql",
          "port": {
            "parameter": 0
          }
        }
      ]
    },
    {
      "call": "sqlalchemy.orm.Session.query",
      "sinks": [
        {
          "kind": "dangerous",
          "port": {
            "parameter": 0
          }
        }
      ]
    },
    {
      "call": "sqlalchemy.engine.base.Connection.execute",
      "cwe": "CWE-89",
      "severity": "high",
      "sinks": [
        {
          "kind": "sql",
          "port": {
            "parameter": 1
          }
        }
      ]
    },
    {
      "call": "sqlalchemy.engine.base.Connection.run_callable",
      "cwe": "CWE-89",
      "severity": "high",
      "sinks": [
        {
          "kind": "sql",
          "port": {
            "parameter": 1
          }
        }
      ]
    },
    {
      "call": "sqlalchemy.engine.base.Connection.scalar",
      "cwe": "CWE-89",
      "severity": "high",
      "sinks": [
        {
          "kind": "sql",
          "port": {
            "parameter": 1
          }
        }
      ]
    },
    {
      "call": "sqlalchemy.engine.base.Engine.execute",
      "cwe": "CWE-89",
      "severity": "high",
      "sinks": [
        {
          "kind": "sql",
          "port": {
            "parameter": 1
          }
        },
        {
          "kind": "sql",
          "port": {
            "parameter": 3
          }
        },
        {
          "kind": "sql",
          "port": {
            "parameter": 4
          }
        }
      ]
    },
    {
      "call": "sqlalchemy.engine.base.Engine.run_callable",
      "cwe": "CWE-89",
      "severity": "high",
      "sinks": [
        {
          "kind": "sql",
          "port": {
            "parameter": 1
          }
        }
      ]
    },
    {
      "call": "sqlalchemy.engine.base.Engine.scalar",
      "cwe": "CWE-89",
      "severity": "high",
      "sinks": [
        {
          "kind": "sql",
          "port": {
            "parameter": 1
          }
        }
      ]
    },
    {
      "call": "sqlalchemy.engine.interfaces.Connectable.execute",
      "cwe": "CWE-89",
      "severity": "high",
      "sinks": [
        {
          "kind": "sql",
          "port": {
            "parameter": 1
          }
        }
      ]
    },
    {
      "call": "sqlalchemy.engine.interfaces.Connectable.scalar",
      "cwe": "CWE-89",
      "severity": "high",
      "sinks": [
        {
          "kind": "sql",
          "port": {
            "parameter": 1
          }
        }
      ]
    }
  ],
  "rules": [
    {
      "id": "PYFLOW-SQLALCHEMY-DANGEROUS",
      "title": "Untrusted data reaches dangerous sink",
      "sources": [
        "user_input",
        "network",
        "file",
        "env",
        "database",
        "secrets",
        "cache",
        "userdata",
        "untrusted",
        "exception"
      ],
      "sinks": [
        "dangerous"
      ],
      "severity": "high"
    },
    {
      "id": "PYFLOW-SQLALCHEMY-SQL",
      "title": "Untrusted data reaches sql sink",
      "sources": [
        "user_input",
        "network",
        "file",
        "env",
        "database",
        "secrets",
        "cache",
        "userdata",
        "untrusted",
        "exception"
      ],
      "sinks": [
        "sql"
      ],
      "severity": "high"
    }
  ],
  "type": "taint"
}
